{
  "schema_version": "1.3.0",
  "case_id": "neurips2025-0031-optimal-adjustment-sets-for-nonparametric-estimation-of-weighte",
  "revision": 1,
  "previous_revision": null,
  "case_type": "prospective_audit",
  "created_at": "2026-10-21T07:13:27.568206+00:00",
  "source": {
    "title": "Optimal Adjustment Sets for Nonparametric Estimation of Weighted Controlled Direct Effect",
    "version": "arXiv:2506.09871v4 (current author version; updated 2026-02-05T21:43:37Z)",
    "doi": null,
    "arxiv_id": null,
    "identifier_note": "The selected author/publisher source is the same work as the original case, matched by exact title, author identity and official version channel. The exact selected PDF SHA-256 was recomputed in the latest-version pass for Issue #27. The PDF was downloaded from its version-specific official URL at the recorded time.",
    "artifact": {
      "path": "source/neurips2025-0031-optimal-adjustment-sets-for-nonparametric-estimation-of-weighte.md",
      "sha256": "202620bf4270200e040fc087bdfce49da588f625615e1a4f0be872db6e6fd0c0"
    },
    "review_scope": "Latest-version, claim-focused review of the cited author-paper passages and applicable current author-release paths. The stated counterexamples and scope controls were checked analytically; no author program, old verifier, training run or benchmark was executed."
  },
  "audit": {
    "venue": "NeurIPS",
    "year": 2025,
    "authors": [
      "Ruiyang Lin",
      "Yongyi Guo",
      "Kyra Gan"
    ],
    "landing_url": "https://arxiv.org/abs/2506.09871v4",
    "pdf_url": "https://arxiv.org/pdf/2506.09871v4",
    "pdf_sha256": "839d61c86b2fe7c66cf9ac965420fc12a6b8167b43fd02453877350be324baa3",
    "retrieved_at": "2026-10-21T06:36:06.076571+00:00",
    "outcome": "candidate_issue",
    "summary": "The universal O-set variance-optimality theorem has a positive-support counterexample, and the paper's half-residual AIPW formula fails the intended bias cancellation. These core estimation errors determine Major. ASIA support restrictions and necessity wording remain bounded corrections; not every influence-function component is invalid.",
    "limitations": [
      "Independent scientific adjudication remains pending.",
      "No author code, model training or full benchmark evaluation was executed in this revision.",
      "Version-specific source defects do not establish which code produced the published experiments.",
      "Corrected benchmark scores, empirical effect sizes and author adoption remain unverified unless explicitly stated.",
      "No new author-code execution, model spending, training, author contact or complete benchmark replication.",
      "Historical numerical results are retained evidence rather than current reruns.",
      "Local counterexamples do not invalidate every empirical result; missing historical run attribution remains unresolved."
    ]
  },
  "proposition": {
    "claim": "Theorem 4.3 says all non-treatment parents of Y form a universally variance-optimal allowed adjustment set.\n\nEq.5.1 is presented as an influence-function-based AIPW construction.\n\nTable 3 uses seven adjustment sets to compare nonparametric regular-estimator efficiency.\n\nLemma 2.6 calls the adjustment conditions both sufficient and necessary for WCDE.",
    "domain": "Latest-version, claim-focused review of the cited author-paper passages and applicable current author-release paths. The stated counterexamples and scope controls were checked analytically; no author program, old verifier, training run or benchmark was executed.",
    "assumptions": [
      "The exact source version and operative conditions stated in this analysis."
    ],
    "location": "Current arXiv v4 Theorem 4.3 and Definitions 4.1–4.2, PDF pp.6–7; Appendix C.5 proof\n\nPaper Eq. (5.1), p. 9; author asia.py, lines 205-212, and parallel released estimator implementations.\n\nPaper Table 3, pp. 9-10; author-released asia.bif, either and lung conditional probability tables.\n\nLemma 2.6, p.4; Appendix B.1, pp.27–28; CDE counterevidence pp.24–25.",
    "dependencies": []
  },
  "concern": {
    "description": "The universal O-set variance-optimality theorem has a positive-support counterexample, and the paper's half-residual AIPW formula fails the intended bias cancellation. These core estimation errors determine Major. ASIA support restrictions and necessity wording remain bounded corrections; not every influence-function component is invalid.\n\nImpact assessment. The universal O-set theorem has an admissible smaller-variance alternative, and the paper's half-residual AIPW formula fails its central bias-cancellation property. Both meet the stricter Major criterion.",
    "type": "other",
    "severity": "major",
    "impact": "unknown",
    "origin": "ai"
  },
  "evidence": [
    {
      "id": "analysis-and-boundaries",
      "stance": "support",
      "description": "The universal O-set variance-optimality theorem has a positive-support counterexample, and the paper's half-residual AIPW formula fails the intended bias cancellation. These core estimation errors determine Major. ASIA support restrictions and necessity wording remain bounded corrections; not every influence-function component is invalid.",
      "method": "Current AI source and argument inspection; retained computations were not rerun.",
      "artifact": {
        "path": "evidence/neurips2025-0031-optimal-adjustment-sets-for-nonparametric-estimation-of-weighte/review.md",
        "sha256": "e139a1510f82a4b02965ad4ba476e383a662cc8fb3f9f6b109054c68a42930ce"
      }
    },
    {
      "id": "scope-and-rebuttal",
      "stance": "rebuttal",
      "description": "Independent scientific adjudication remains pending. No author code, model training or full benchmark evaluation was executed in this revision. Version-specific source defects do not establish which code produced the published experiments. Corrected benchmark scores, empirical effect sizes and author adoption remain unverified unless explicitly stated. No new author-code execution, model spending, training, author contact or complete benchmark replication. Historical numerical results are retained evidence rather than current reruns. Local counterexamples do not invalidate every empirical result; missing historical run attribution remains unresolved.",
      "method": "Per-problem assessment, source checks, counterevidence and inherited execution limits.",
      "artifact": {
        "path": "evidence/neurips2025-0031-optimal-adjustment-sets-for-nonparametric-estimation-of-weighte/verification.json",
        "sha256": "6b9ec4f0e019c0495f77dc5e7cfb854c06b3a00d9fdcd5bcf24a7177ce54f5d1"
      }
    },
    {
      "id": "editable-latex",
      "stance": "support",
      "description": "Editable English LaTeX of the curated analysis and existing corrections.",
      "method": "Typeset source generated from the same reviewed problem paragraphs.",
      "artifact": {
        "path": "evidence/neurips2025-0031-optimal-adjustment-sets-for-nonparametric-estimation-of-weighte/report.tex",
        "sha256": "1abbb7ae7cf78f1c1aca9530072990f48ab58c3d1033a91498f4f8d1ab15adf7"
      }
    }
  ],
  "runs": [],
  "human_reviews": [],
  "adjudication": {
    "status": "pending",
    "rationale": "Preliminary AI source/logic review; no independent human scientific adjudication.",
    "history": [
      {
        "at": "2026-10-21T07:13:27.568206+00:00",
        "status": "pending",
        "rationale": "Preliminary AI source/logic review; no independent human scientific adjudication."
      }
    ]
  },
  "repair": {
    "content": "Restrict or re-establish the optimality theorem. No general replacement optimal set is proved; the reported influence function itself remains a valid retained component.\n\nDouble the residual correction inside the overall one-half factor. This algebra restores that cancellation identity; flexible-nuisance regularity/normality needs additional conditions.\n\nExclude unsupported sets from the nonparametric efficiency comparison or label the extra outcome-extrapolation model; full table reruns remain undone.\n\nNarrow the necessity claim to its correctly established target/domain. No new complete necessary-and-sufficient adjustment criterion is provided.",
    "verification_status": "pending",
    "verification_refs": [],
    "changed_assumptions": [],
    "changed_conclusion": null,
    "adoption_status": "not_requested"
  },
  "publication": {
    "status": "preliminary_ai",
    "note": "Maintainer-authorized private review collection (Issue #27). Source/logic inspection is distinct from independent scientific confirmation. No author contact or adoption."
  }
}
