{
  "schema_version": "1.3.0",
  "case_id": "neurips2025-0099-dendritic-resonate-and-fire-neuron-for-effective-and-efficient",
  "revision": 1,
  "previous_revision": null,
  "case_type": "prospective_audit",
  "created_at": "2026-10-21T07:13:27.568206+00:00",
  "source": {
    "title": "Dendritic Resonate-and-Fire Neuron for Effective and Efficient Long Sequence Modeling",
    "version": "NeurIPS 2025 official proceedings PDF; compared with current arXiv:2509.17186v2",
    "doi": null,
    "arxiv_id": null,
    "identifier_note": "The selected author/publisher source is the same work as the original case, matched by exact title, author identity and official version channel. The exact selected PDF SHA-256 was recomputed in the latest-version pass for Issue #27. The PDF is a retained author/publisher copy; its original retrieval time is stated only when supported by matching acquisition metadata. File modification time was not substituted.",
    "artifact": {
      "path": "source/neurips2025-0099-dendritic-resonate-and-fire-neuron-for-effective-and-efficient.md",
      "sha256": "d7afbdf220fc316cb3f91736b62ddc26d6ba8207dd0192c5fe67b828f92f9e90"
    },
    "review_scope": "Latest-version, claim-focused review of the cited author-paper passages and applicable current author-release paths. The stated counterexamples and scope controls were checked analytically; no author program, old verifier, training run or benchmark was executed."
  },
  "audit": {
    "venue": "NeurIPS",
    "year": 2025,
    "authors": [
      "Dehao Zhang",
      "Malu Zhang",
      "Shuai Wang",
      "Jingya Wang",
      "Wenjie Wei",
      "Zeyu Ma",
      "Guoqing Wang",
      "Yang Yang",
      "Haizhou Li"
    ],
    "landing_url": "https://proceedings.nips.cc/paper_files/paper/2025/hash/9a6ca401f890aeb2c272d2bb26196d3f-Abstract-Conference.html",
    "pdf_url": "https://papers.nips.cc/paper_files/paper/2025/file/9a6ca401f890aeb2c272d2bb26196d3f-Paper-Conference.pdf",
    "pdf_sha256": "8a4f2ede9002a34aafa8302c6cc7ba117924f4065a9e81a3c1a69aa9caa7be98",
    "retrieved_at": "2026-10-20T06:01:30.067843+00:00",
    "outcome": "candidate_issue",
    "summary": "Branch magnitudes do not give the exact real-soma response, and full adaptive-threshold differentiation includes history. The claim that fixed-width BPTT inherently has quadratic work is false; the public adaptive path is separately incomplete.",
    "limitations": [
      "Preliminary AI assessment; independent human scientific adjudication remains pending.",
      "An analytic counterexample or a release discrepancy does not by itself remeasure the paper’s reported experiments."
    ]
  },
  "proposition": {
    "claim": "Equation (10) equates the soma response magnitude with a weighted sum of individual branch magnitudes.\n\nThe two-stage graph uses preliminary spikes \\(b_t=\\Theta(u_t-V_0)\\), threshold \\(v_t=V_0+\\sum_k\\alpha_kb_{t-k}\\), and final spikes \\(s_t=\\Theta(u_t-v_t)\\).\n\nSections 3.2–4.1 and Appendix B.2 attribute \\(O(L^2)\\) work to recursive BPTT dependencies and describe FFT training as an asymptotic reduction to \\(O(L\\log L)\\).\n\nIn supplemental `models/layers.py`, `BiRFModel` defines static-threshold spikes while adaptive construction and use remain comments.",
    "domain": "Latest-version, claim-focused review of the cited author-paper passages and applicable current author-release paths. The stated counterexamples and scope controls were checked analytically; no author program, old verifier, training run or benchmark was executed.",
    "assumptions": [
      "Only the cited paper version and explicitly described mathematical or implementation conditions are assessed.",
      "State width, branch count and per-step operations are fixed with sequence length; arithmetic work is distinguished from parallel span and measured wall-clock time."
    ],
    "location": "Section 4.2, PDF p.5, Eqs.(7)–(10); Appendix A.3, PDF pp.22–23\n\nSection 4.3, PDF pp.5–7, Eqs.(11)–(16); Appendix B.1, PDF p.25\n\nEnd of Section 3.2 and Figure 1(c), PDF p.4; Appendix B.2, PDF p.25\n\nSection 4.3, PDF pp.5–7; Table 4, PDF p.9; supplemental models/layers.py, lines 100–131",
    "dependencies": []
  },
  "concern": {
    "description": "Branch magnitudes do not give the exact real-soma response, and full adaptive-threshold differentiation includes history. The claim that fixed-width BPTT inherently has quadratic work is false; the public adaptive path is separately incomplete.\n\nImpact assessment. Major: the repeated central training-complexity reduction rests on a glaring false quadratic-BPTT premise. Reported hardware speedups and the method’s empirical utility are not disproved.",
    "type": "other",
    "severity": "major",
    "impact": "unknown",
    "origin": "ai"
  },
  "evidence": [
    {
      "id": "analysis-and-boundaries",
      "stance": "support",
      "description": "Branch magnitudes do not give the exact real-soma response, and full adaptive-threshold differentiation includes history. The claim that fixed-width BPTT inherently has quadratic work is false; the public adaptive path is separately incomplete.",
      "method": "Current AI source and argument inspection; retained computations were not rerun.",
      "artifact": {
        "path": "evidence/neurips2025-0099-dendritic-resonate-and-fire-neuron-for-effective-and-efficient/review.md",
        "sha256": "94178560ea640c70939bb0f236aef14657dbf8b63f9955e71d644096afed088c"
      }
    },
    {
      "id": "scope-and-rebuttal",
      "stance": "rebuttal",
      "description": "Preliminary AI assessment; independent human scientific adjudication remains pending. An analytic counterexample or a release discrepancy does not by itself remeasure the paper’s reported experiments.",
      "method": "Per-problem assessment, source checks, counterevidence and inherited execution limits.",
      "artifact": {
        "path": "evidence/neurips2025-0099-dendritic-resonate-and-fire-neuron-for-effective-and-efficient/verification.json",
        "sha256": "84fb0620e65c4a1702bb07354ad3a2a37bf1c3baed9ccd05ffe15623c8c7bad2"
      }
    },
    {
      "id": "editable-latex",
      "stance": "support",
      "description": "Editable English LaTeX of the curated analysis and existing corrections.",
      "method": "Typeset source generated from the same reviewed problem paragraphs.",
      "artifact": {
        "path": "evidence/neurips2025-0099-dendritic-resonate-and-fire-neuron-for-effective-and-efficient/report.tex",
        "sha256": "35504907e98f1df45b8104cd39be1faa3e098bca5a090eb363d6484aa3906e29"
      }
    }
  ],
  "runs": [],
  "human_reviews": [],
  "adjudication": {
    "status": "pending",
    "rationale": "Preliminary AI source/logic review; no independent human scientific adjudication.",
    "history": [
      {
        "at": "2026-10-21T07:13:27.568206+00:00",
        "status": "pending",
        "rationale": "Preliminary AI source/logic review; no independent human scientific adjudication."
      }
    ]
  },
  "repair": {
    "content": "Combine complex transfer functions first, with \\(|\\sum_iC_iH_i|\\leq\\sum_i|C_i||H_i|\\). For a real soma/input, derive the real impulse response before taking its Fourier transform.\n\nInclude the history adjoint or name the stop-gradient rule and analyze it separately. The public main path disables adaptation, so this does not identify historical model gradients.\n\nCompare linear-work recurrent differentiation, quadratic naive dense convolution and FFT convolution with explicit width, branch, memory and parallel-span assumptions.\n\nIdentify the actual adaptive training module and per-experiment configuration rather than treating post-hoc plots or commented code as activated training. No complete repaired experiment is supplied.",
    "verification_status": "pending",
    "verification_refs": [],
    "changed_assumptions": [],
    "changed_conclusion": null,
    "adoption_status": "not_requested"
  },
  "publication": {
    "status": "preliminary_ai",
    "note": "Maintainer-authorized private review collection (Issue #27). Source/logic inspection is distinct from independent scientific confirmation. No author contact or adoption."
  }
}
