{
  "schema_version": "1.3.0",
  "case_id": "neurips2025-0043-unigte-unified-graph-text-encoding-for-zero-shot-generalization",
  "revision": 1,
  "previous_revision": null,
  "case_type": "prospective_audit",
  "created_at": "2026-10-21T07:13:27.568206+00:00",
  "source": {
    "title": "UniGTE: Unified Graph–Text Encoding for Zero-Shot Generalization across Graph Tasks and Domains",
    "version": "NeurIPS 2025 official proceedings PDF (current publisher bytes, checked 2026-10-21)",
    "doi": null,
    "arxiv_id": null,
    "identifier_note": "This is the same research work as the predecessor, matched by title, author identity and official publisher channel. Its freshly retrieved exact PDF bytes and real retrieval time are recorded. Current target arXiv metadata and the relevant available author-version passages were checked separately; background works were excluded. Original report/source history is unchanged.",
    "artifact": {
      "path": "source/neurips2025-0043-unigte-unified-graph-text-encoding-for-zero-shot-generalization.md",
      "sha256": "09022aecb65e795359438373ba81442375e736eef33cc6a1af57727b162c4ada"
    },
    "review_scope": "Latest-version, claim-focused review of the cited author-paper passages and applicable current author-release paths. The stated counterexamples and scope controls were checked analytically; no author program, old verifier, training run or benchmark was executed."
  },
  "audit": {
    "venue": "NeurIPS",
    "year": 2025,
    "authors": [
      "Duo Wang",
      "Yuan Zuo",
      "Guangyue Lu",
      "Junjie Wu"
    ],
    "landing_url": "https://proceedings.nips.cc/paper_files/paper/2025/hash/84e3cc09f56108559cd28754d94c5e06-Abstract-Conference.html",
    "pdf_url": "https://proceedings.nips.cc/paper_files/paper/2025/file/84e3cc09f56108559cd28754d94c5e06-Paper-Conference.pdf",
    "pdf_sha256": "51bd85571a8d0ee33b8dad742d5a569e5668ab8878a5685a3e66ef1e71002b58",
    "retrieved_at": "2026-10-21T06:36:11.007607+00:00",
    "outcome": "candidate_issue",
    "summary": "Choosing one tied shortest path by node-index order can make heterogeneous edge bias depend on node numbering. This invalidates an unconditional architectural permutation guarantee; it does not measure failures of the published checkpoint.",
    "limitations": [
      "Independent scientific adjudication remains pending.",
      "No author code, model training or full benchmark evaluation was executed in this revision.",
      "Version-specific source defects do not establish which code produced the published experiments.",
      "Corrected benchmark scores, empirical effect sizes and author adoption remain unverified unless explicitly stated.",
      "Local contradictions and specification differences do not establish the magnitude or direction of changes to the published benchmark scores.",
      "No author contact or adoption; novelty and complete historical-run provenance are unestablished."
    ]
  },
  "proposition": {
    "claim": "The full graph attention is described as permutation invariant, with edge scores averaged over a selected shortest path.",
    "domain": "Latest-version, claim-focused review of the cited author-paper passages and applicable current author-release paths. The stated counterexamples and scope controls were checked analytically; no author program, old verifier, training run or benchmark was executed.",
    "assumptions": [
      "The finding concerns the stated source version and mathematical or released-code scope."
    ],
    "location": "Section 2.2.2, Eq. (4) and complete-attention invariance statement, PDF pp. 4–5; author modeling/ft_datasets/algos.pyx, floyd_warshall, lines 9–55.",
    "dependencies": []
  },
  "concern": {
    "description": "Choosing one tied shortest path by node-index order can make heterogeneous edge bias depend on node numbering. This invalidates an unconditional architectural permutation guarantee; it does not measure failures of the published checkpoint.\n\nImpact assessment. Major is reserved here for the following supported core-claim or substantial derivation failure: Index-dependent shortest-path ties break edge-bias equivariance. Other local defects and unresolved candidates do not raise this assessment.",
    "type": "other",
    "severity": "major",
    "impact": "unknown",
    "origin": "ai"
  },
  "evidence": [
    {
      "id": "analysis-and-boundaries",
      "stance": "support",
      "description": "Choosing one tied shortest path by node-index order can make heterogeneous edge bias depend on node numbering. This invalidates an unconditional architectural permutation guarantee; it does not measure failures of the published checkpoint.",
      "method": "Current AI source and argument inspection; retained computations were not rerun.",
      "artifact": {
        "path": "evidence/neurips2025-0043-unigte-unified-graph-text-encoding-for-zero-shot-generalization/review.md",
        "sha256": "99064a9bd1bb33780263e866b5320690ab3116a0bb3c624ddb4a04a3a1d9f194"
      }
    },
    {
      "id": "scope-and-rebuttal",
      "stance": "rebuttal",
      "description": "Independent scientific adjudication remains pending. No author code, model training or full benchmark evaluation was executed in this revision. Version-specific source defects do not establish which code produced the published experiments. Corrected benchmark scores, empirical effect sizes and author adoption remain unverified unless explicitly stated. Local contradictions and specification differences do not establish the magnitude or direction of changes to the published benchmark scores. No author contact or adoption; novelty and complete historical-run provenance are unestablished.",
      "method": "Per-problem assessment, source checks, counterevidence and inherited execution limits.",
      "artifact": {
        "path": "evidence/neurips2025-0043-unigte-unified-graph-text-encoding-for-zero-shot-generalization/verification.json",
        "sha256": "e52fed90243bf59f8eb55702ed8822483b0c5a5cc4a77b73ee3baeb75e4164f7"
      }
    },
    {
      "id": "editable-latex",
      "stance": "support",
      "description": "Editable English LaTeX of the curated analysis and existing corrections.",
      "method": "Typeset source generated from the same reviewed problem paragraphs.",
      "artifact": {
        "path": "evidence/neurips2025-0043-unigte-unified-graph-text-encoding-for-zero-shot-generalization/report.tex",
        "sha256": "9016ab59e68472c8d4a169deb9b1b4316f0a1ec131b131353069407b0b3bcb43"
      }
    }
  ],
  "runs": [],
  "human_reviews": [],
  "adjudication": {
    "status": "pending",
    "rationale": "Preliminary AI source/logic review; no independent human scientific adjudication.",
    "history": [
      {
        "at": "2026-10-21T07:13:27.568206+00:00",
        "status": "pending",
        "rationale": "Preliminary AI source/logic review; no independent human scientific adjudication."
      }
    ]
  },
  "repair": {
    "content": "Aggregate shortest-path edge information equivariantly, or state the unique-path/equal-score restriction. This changes the definition and is not a verified trained-model repair.",
    "verification_status": "pending",
    "verification_refs": [],
    "changed_assumptions": [],
    "changed_conclusion": null,
    "adoption_status": "not_requested"
  },
  "publication": {
    "status": "preliminary_ai",
    "note": "Maintainer-authorized private review collection (Issue #27). Source/logic inspection is distinct from independent scientific confirmation. No author contact or adoption."
  }
}
