{
  "schema_version": "1.2.0",
  "case_id": "icml2025-0163-promoting-ensemble-diversity-with-interactive-bayesian-distributio",
  "revision": 1,
  "previous_revision": null,
  "case_type": "prospective_audit",
  "created_at": "2026-10-26T04:21:21.357774+00:00",
  "source": {
    "title": "Promoting Ensemble Diversity with Interactive Bayesian Distributional Robustness for Fine-tuning Foundation Models",
    "version": "Published ICML 2025 proceedings PDF (PMLR 267)",
    "doi": null,
    "arxiv_id": null,
    "identifier_note": "Publisher proceedings identity and supplied paper identifier I25-43532; no DOI is fabricated.",
    "artifact": {
      "path": "source/icml2025-0163-promoting-ensemble-diversity-with-interactive-bayesian-distributio.md",
      "sha256": "ef07ffd771473352b393ea46e3ef6bce89b0f0de73eb7836811f005701d0a72c"
    },
    "review_scope": "Completed report for I25-43532; exact inspected scope and limitations are retained in the report and coverage ledger."
  },
  "audit": {
    "venue": "ICML",
    "year": 2025,
    "authors": [
      "Ngoc Quan Pham",
      "Tuan Truong",
      "Quyen Tran",
      "Tan Nguyen",
      "Dinh Phung",
      "Trung Le"
    ],
    "landing_url": "https://proceedings.mlr.press/v267/pham25b.html",
    "pdf_url": "https://raw.githubusercontent.com/mlresearch/v267/main/assets/pham25b/pham25b.pdf",
    "pdf_sha256": "a078575bb5472e7ea5fbb263f19ac90ee115e8f9d067e15232cc0199293f3812",
    "retrieved_at": null,
    "outcome": "candidate_issue",
    "summary": "Archived assessment: Major. Positive determinant has opposite minimization preference; Binary non-target normalization removes diversity signal; Incorrect Gaussian KL term in core bound.",
    "limitations": [
      "Table1 AVG values differ from unweighted means; aggregation convention and raw records unavailable.",
      "Posterior iid-mixture versus one-per-component sampling and bounded-loss/uniformity assumptions not fully certified.",
      "Preserved release not bound to historical experiments; snapshot lacks imported swag component; no author code executed.",
      "No raw results, benchmark reruns, later revisions or additional OpenReview-only attachments inspected.",
      "The original report's complete scope, counterevidence and unresolved questions are retained below.",
      "This import checks publication format and identity; it does not repeat scientific review.",
      "Independent human scientific review is pending; author adoption has not been requested."
    ]
  },
  "proposition": {
    "claim": "Joint loss promotes particle diversity\n\nExplicit diversity interaction applies in reported binary task\n\nCorollary4.3 Gaussian complexity substitution",
    "domain": "Completed report for I25-43532; exact inspected scope and limitations are retained in the report and coverage ledger.",
    "assumptions": [
      "Positive alpha; two particles, three classes; strictly positive probabilities and identical true-label probabilities",
      "Binary classes, positive softmax probabilities, hard-label non-target normalization, K4",
      "Q mixture N(mu_i,sigma\u00b2I), P N(0,I); d1, allmeans0,sigma.1"
    ],
    "location": "PDF pp4\u20136, Sections4.2\u20134.3, Eq5\n\nPDF pp5\u20137; Camelyon tables; src/data.py103\u2013108; configs/dro/patch_camelyon.yaml27\n\nPDF p6 and AppendixC p18",
    "dependencies": []
  },
  "concern": {
    "description": "Archived assessment: Major. Positive determinant has opposite minimization preference; Binary non-target normalization removes diversity signal; Incorrect Gaussian KL term in core bound.",
    "type": "other",
    "severity": "major",
    "impact": "unknown",
    "origin": "ai"
  },
  "evidence": [
    {
      "id": "retained-findings",
      "stance": "support",
      "description": "Existing findings, counterevidence and bounded classifications; no scientific reassessment performed during import.",
      "method": "Formatting-only transcription of the selected completed report.",
      "artifact": {
        "path": "evidence/icml2025-0163-promoting-ensemble-diversity-with-interactive-bayesian-distributio/findings.json",
        "sha256": "9e8dd8d42e6e60f7afff20dc07198fcd488396a92cfeb3dc19a7dd19fdb35d41"
      }
    },
    {
      "id": "retained-report",
      "stance": "support",
      "description": "Complete public transcription of the retained report, with internal workflow identifiers and host paths omitted.",
      "method": "LaTeX parsed as data; no author code or TeX execution.",
      "artifact": {
        "path": "evidence/icml2025-0163-promoting-ensemble-diversity-with-interactive-bayesian-distributio/report.txt",
        "sha256": "16d6a7d0a1ee7906f8535e1d91362775ad615b036c10aa89381ba130fe2fb1a4"
      }
    },
    {
      "id": "scope-and-rebuttal",
      "stance": "rebuttal",
      "description": "Existing inspection coverage, counterevidence, missing materials and unresolved scope remain as supplied.",
      "method": "Public copy of the archived coverage ledger.",
      "artifact": {
        "path": "evidence/icml2025-0163-promoting-ensemble-diversity-with-interactive-bayesian-distributio/coverage.json",
        "sha256": "4489490891d078f223d2d66bc1687d6b5afbcf20b90006673f986ff6f0faa29d"
      }
    },
    {
      "id": "editable-latex",
      "stance": "support",
      "description": "Public editable report generated from the same retained transcription.",
      "method": "Formatting conversion only; original archive bytes remain unchanged.",
      "artifact": {
        "path": "evidence/icml2025-0163-promoting-ensemble-diversity-with-interactive-bayesian-distributio/report.tex",
        "sha256": "11426bf3d7e992e26f7d88a4b0720c125deeb065370e2768808cd436c306756c"
      }
    }
  ],
  "runs": [],
  "human_reviews": [],
  "adjudication": {
    "status": "pending",
    "rationale": "Preliminary AI-assisted report; independent human scientific adjudication remains pending.",
    "history": []
  },
  "repair": {
    "content": "Correct sign/objective and recheck theorem assumptions; no full repair certified\n\nSpecify rank-aware or different diversity representation; no replacement validated\n\nUse sigma\u00b2\u22121\u22122log sigma; preceding theorem and whole bound remain separately unverified",
    "verification_status": "pending",
    "verification_refs": [],
    "changed_assumptions": [],
    "changed_conclusion": null,
    "adoption_status": "not_requested"
  },
  "publication": {
    "status": "preliminary_ai",
    "note": "Maintainer-authorized publication of ICML batches B001\u2013B004 (Issue #18). Existing findings retain their scope; publication is not independent scientific confirmation."
  }
}
