{
  "schema_version": "1.2.0",
  "case_id": "icml2025-0351-model-immunization-from-a-condition-number-perspective",
  "revision": 1,
  "previous_revision": null,
  "case_type": "prospective_audit",
  "created_at": "2026-10-26T04:21:21.357774+00:00",
  "source": {
    "title": "Model Immunization from a Condition Number Perspective",
    "version": "PMLR 267 published version fetched from supplied mlresearch source URL",
    "doi": null,
    "arxiv_id": null,
    "identifier_note": "Publisher proceedings identity and supplied paper identifier I25-43720; no DOI is fabricated.",
    "artifact": {
      "path": "source/icml2025-0351-model-immunization-from-a-condition-number-perspective.md",
      "sha256": "19c94d7e4b4d5afcd69f9a4c84595ffc3f9c487081b0c031f982b78bbfcc1b05"
    },
    "review_scope": "Completed report for I25-43720; exact inspected scope and limitations are retained in the report and coverage ledger."
  },
  "audit": {
    "venue": "ICML",
    "year": 2025,
    "authors": [
      "Amber Yijia Zheng",
      "Cedar Site Bai",
      "Brian Bullins",
      "Raymond A. Yeh"
    ],
    "landing_url": "https://proceedings.mlr.press/v267/zheng25a.html",
    "pdf_url": "https://raw.githubusercontent.com/mlresearch/v267/main/assets/zheng25a/zheng25a.pdf",
    "pdf_sha256": "a1a12710dbd7b4eb2f6a30b22d30260f2295ceac43ed03e994e6baf41261f060",
    "retrieved_at": null,
    "outcome": "candidate_issue",
    "summary": "Two exact counterexamples invalidate core theoretical derivations; one local transpose inconsistency in released preconditioning.",
    "limitations": [
      "No author code or training executed.",
      "No historical implementation identity or empirical effect inferred.",
      "Rank-changing ill-regularizer domain and complete Theorem 4.3(2) not certified.",
      "Later revisions and author adoption unknown.",
      "Test-accuracy early stopping merits clarification; bias magnitude unestablished.",
      "The original report's complete scope, counterevidence and unresolved questions are retained below.",
      "This import checks publication format and identity; it does not repeat scientific review.",
      "Independent human scientific review is pending; author adoption has not been requested."
    ]
  },
  "proposition": {
    "claim": "Proposition 3.2 Eq.(10) lists singular values of theta^T K theta\n\nTheorem 4.3(1) guarantees decreasing condition number for displayed step interval\n\nDummy-layer covariance preconditioning implements Algorithm 1",
    "domain": "Completed report for I25-43720; exact inspected scope and limitations are retained in the report and coverage ledger.",
    "assumptions": [
      "square linear theta",
      "K=X^T X PSD",
      "no singular-vector alignment hypothesis",
      "K=I positive definite",
      "d=rank=2",
      "H diag(4,1) unique largest",
      "eta=1/5 < min(1/2,2)",
      "Y=X W^T hence theta=W^T",
      "square full-rank X",
      "lambda=1",
      "K=diag(2,1)",
      "G_W off-diagonal ones"
    ],
    "location": "PDF pp.3,13-14; Appendix B.1\n\nPDF pp.4-5,20-22; Appendix B.4\n\nPDF p.26 Figure 4; models/linear.py forward/backward; models/model.py reg_loss",
    "dependencies": []
  },
  "concern": {
    "description": "Two exact counterexamples invalidate core theoretical derivations; one local transpose inconsistency in released preconditioning.",
    "type": "other",
    "severity": "major",
    "impact": "unknown",
    "origin": "ai"
  },
  "evidence": [
    {
      "id": "retained-findings",
      "stance": "support",
      "description": "Existing findings, counterevidence and bounded classifications; no scientific reassessment performed during import.",
      "method": "Formatting-only transcription of the selected completed report.",
      "artifact": {
        "path": "evidence/icml2025-0351-model-immunization-from-a-condition-number-perspective/findings.json",
        "sha256": "6a90f5a9515c5a65055c2174b86697457d3808346956836a202b1a9b08125b16"
      }
    },
    {
      "id": "retained-report",
      "stance": "support",
      "description": "Complete public transcription of the retained report, with internal workflow identifiers and host paths omitted.",
      "method": "LaTeX parsed as data; no author code or TeX execution.",
      "artifact": {
        "path": "evidence/icml2025-0351-model-immunization-from-a-condition-number-perspective/report.txt",
        "sha256": "48b974ae919c015f6e370704dd3db874adc49f1b6f9615fdfbdbc6facd3bbde2"
      }
    },
    {
      "id": "scope-and-rebuttal",
      "stance": "rebuttal",
      "description": "Existing inspection coverage, counterevidence, missing materials and unresolved scope remain as supplied.",
      "method": "Public copy of the archived coverage ledger.",
      "artifact": {
        "path": "evidence/icml2025-0351-model-immunization-from-a-condition-number-perspective/coverage.json",
        "sha256": "983d9176e9b29a8ae1c3ed0ea58fe1dab5e2d2eeda6f0cb4034d519f6ffd1e72"
      }
    },
    {
      "id": "editable-latex",
      "stance": "support",
      "description": "Public editable report generated from the same retained transcription.",
      "method": "Formatting conversion only; original archive bytes remain unchanged.",
      "artifact": {
        "path": "evidence/icml2025-0351-model-immunization-from-a-condition-number-perspective/report.tex",
        "sha256": "b613cca92af834ca18948645b6a8cc1a475c6d301c866115500b8d2d8fd02074"
      }
    }
  ],
  "runs": [],
  "human_reviews": [],
  "adjudication": {
    "status": "pending",
    "rationale": "Preliminary AI-assisted report; independent human scientific adjudication remains pending.",
    "history": []
  },
  "repair": {
    "content": "Spectrum is eigenvalues of Sigma U^T K U Sigma, not its diagonal\n\nRight multiplication or transposed solve restores theta-axis convention",
    "verification_status": "pending",
    "verification_refs": [],
    "changed_assumptions": [],
    "changed_conclusion": null,
    "adoption_status": "not_requested"
  },
  "publication": {
    "status": "preliminary_ai",
    "note": "Maintainer-authorized publication of ICML batches B001\u2013B004 (Issue #18). Existing findings retain their scope; publication is not independent scientific confirmation."
  }
}
