{
  "schema_version": "1.2.0",
  "case_id": "icml2025-0197-typybench-evaluating-llm-type-inference-for-untyped-python-reposit",
  "revision": 1,
  "previous_revision": null,
  "case_type": "prospective_audit",
  "created_at": "2026-10-26T04:21:21.357774+00:00",
  "source": {
    "title": "TypyBench: Evaluating LLM Type Inference for Untyped Python Repositories",
    "version": "Published ICML 2025 proceedings PDF (PMLR 267)",
    "doi": null,
    "arxiv_id": null,
    "identifier_note": "Publisher proceedings identity and supplied paper identifier I25-43566; no DOI is fabricated.",
    "artifact": {
      "path": "source/icml2025-0197-typybench-evaluating-llm-type-inference-for-untyped-python-reposit.md",
      "sha256": "f923a5c848933fa2dbaff2d2ac3f937fa9c33a6d42432a53fa0278dea4e1d14f"
    },
    "review_scope": "Completed report for I25-43566; exact inspected scope and limitations are retained in the report and coverage ledger."
  },
  "audit": {
    "venue": "ICML",
    "year": 2025,
    "authors": [
      "Honghua Dong",
      "Jiacheng Yang",
      "Xun Deng",
      "Yuhe Jiang",
      "Gennady Pekhimenko",
      "Fan Long",
      "Xujie Si"
    ],
    "landing_url": "https://proceedings.mlr.press/v267/dong25l.html",
    "pdf_url": "https://raw.githubusercontent.com/mlresearch/v267/main/assets/dong25l/dong25l.pdf",
    "pdf_sha256": "cedd43736ab0bfe6fc28e917e93aab07e1f8aec4353c01f8a0ef7d6aa9c868bc",
    "retrieved_at": null,
    "outcome": "candidate_issue",
    "summary": "Core TypeCheck interpretation does not distinguish stub declaration consistency from compatibility with unchanged implementation. Two bounded released-code defects affect inherited attribute similarity and cache-reloaded exact-match scalar. Supplementary aggregate arithmetic agrees with printed main results.",
    "limitations": [
      "Stub-only checker counts omit original implementation obligations \u2014 Counterevidence: Stubs retain useful declaration/import/inheritance checks. Missing-rate is also reported. Neither addresses the complete-signature counterexample. Historical prediction directory contents/experiment commit are not supplied, so historical rankings are not declared reversed.",
      "Local symbol names do not equal supported inherited operations \u2014 Counterevidence: A declaration-only similarity is mathematically coherent but differs from the paper's stated supported-operation semantics. Paper's experiment environment was Mypy1.11.1; no exact-environment empirical rerun claimed.",
      "Cached exact-match-without-missing loads the TypeSim key \u2014 Counterevidence: Fresh computation/saved exact field is correct. Exact-match depth arrays are loaded separately. Historical usage of faulty cached scalar is unknown.",
      "Limitations: Historical experiment commit and prediction folders not verified",
      "Limitations: No author code, dataset, model APIs or empirical benchmark rerun",
      "Limitations: Independent synthetic mypy tests used1.14.1/Python3.13.5 versus paper1.11.1/Python3.12",
      "Limitations: Separate OpenReview attachment unavailable (403 acquisition)",
      "Limitations: Source plots checked through extracted context and numerical tables; parent inspects rendered key pages",
      "Limitations: Completed by parent; see provenance execution_facts.compile and visual_qa.",
      "The original report's complete scope, counterevidence and unresolved questions are retained below.",
      "This import checks publication format and identity; it does not repeat scientific review.",
      "Independent human scientific review is pending; author adoption has not been requested."
    ]
  },
  "proposition": {
    "claim": "Section 4.2 motivates TypeCheck as detecting incompatibility of predicted return/argument types at use sites; Section 6.2 compares predicted error counts with original-repository 141.8 errors as evidence of consistency.\n\nSection4.1.1 uses supported methods/operations for the base Jaccard score.\n\nReleased evaluator exports separate TypeSim and exact-match fields for all and nonmissing cases.",
    "domain": "Completed report for I25-43566; exact inspected scope and limitations are retained in the report and coverage ledger.",
    "assumptions": [
      "Complete syntactically valid predicted stub signatures",
      "Explicit ordinary primitive types, no Any",
      "Original function implementations and call sites fixed",
      "Separate original/prediction checker inputs, as in released dataflow",
      "Two distinct named ordinary classes",
      "Child inherits Base.read unchanged and adds nothing",
      "No generics, union, Any, or overrides",
      "Supported operations include inherited methods",
      "Existing cache has both scalar fields",
      "TypeSim and exact scores differ",
      "Cache branch executed"
    ],
    "location": "PDF pp.5,7; Figs.1,9-10 and p.14 prompts; released repo_similarity.py:get_repo_similarity, helpers.py:get_type_dict_from_repo, evaluation.py:evaluate, Dockerfile entry point.\n\nPDF p.4; released type_similarity.py:get_type_attributes,_get_type_info_similarity,get_type_similarity\n\nscripts/evaluation.py:evaluate cache load and cache save blocks, CSV overall_score_wo_missing_exact output",
    "dependencies": []
  },
  "concern": {
    "description": "Core TypeCheck interpretation does not distinguish stub declaration consistency from compatibility with unchanged implementation. Two bounded released-code defects affect inherited attribute similarity and cache-reloaded exact-match scalar. Supplementary aggregate arithmetic agrees with printed main results.",
    "type": "other",
    "severity": "major",
    "impact": "unknown",
    "origin": "ai"
  },
  "evidence": [
    {
      "id": "retained-findings",
      "stance": "support",
      "description": "Existing findings, counterevidence and bounded classifications; no scientific reassessment performed during import.",
      "method": "Formatting-only transcription of the selected completed report.",
      "artifact": {
        "path": "evidence/icml2025-0197-typybench-evaluating-llm-type-inference-for-untyped-python-reposit/findings.json",
        "sha256": "dc30dfbe8f68e0611a44d219e721ed2065946fe89c22daf06d9de8ef3afb89e8"
      }
    },
    {
      "id": "retained-report",
      "stance": "support",
      "description": "Complete public transcription of the retained report, with internal workflow identifiers and host paths omitted.",
      "method": "LaTeX parsed as data; no author code or TeX execution.",
      "artifact": {
        "path": "evidence/icml2025-0197-typybench-evaluating-llm-type-inference-for-untyped-python-reposit/report.txt",
        "sha256": "1651697190d1fe1a50d0778d6fac9e679572eaf02f1bcca0f680df87c4d3202b"
      }
    },
    {
      "id": "scope-and-rebuttal",
      "stance": "rebuttal",
      "description": "Existing inspection coverage, counterevidence, missing materials and unresolved scope remain as supplied.",
      "method": "Public copy of the archived coverage ledger.",
      "artifact": {
        "path": "evidence/icml2025-0197-typybench-evaluating-llm-type-inference-for-untyped-python-reposit/coverage.json",
        "sha256": "f92363a074d82e1b435db41eab87d40e5e1b511c1d10ba02e0fe46da548dcb7b"
      }
    },
    {
      "id": "editable-latex",
      "stance": "support",
      "description": "Public editable report generated from the same retained transcription.",
      "method": "Formatting conversion only; original archive bytes remain unchanged.",
      "artifact": {
        "path": "evidence/icml2025-0197-typybench-evaluating-llm-type-inference-for-untyped-python-reposit/report.tex",
        "sha256": "33f3ad8e96df0adf479ca3030a4a0350a103e1d17371c2b48c0ac74fa038332c"
      }
    }
  ],
  "runs": [],
  "human_reviews": [],
  "adjudication": {
    "status": "pending",
    "rationale": "Preliminary AI-assisted report; independent human scientific adjudication remains pending.",
    "history": []
  },
  "repair": {
    "content": "Apply every model's predictions to a fixed implementation/caller corpus, evaluate identical obligations, and separately count parse and annotation failures.\n\nTraverse the effective inherited symbol set before comparing supported operations.\n\nRead the repo_overall_score_wo_missing_exact cache key.",
    "verification_status": "pending",
    "verification_refs": [],
    "changed_assumptions": [],
    "changed_conclusion": null,
    "adoption_status": "not_requested"
  },
  "publication": {
    "status": "preliminary_ai",
    "note": "Maintainer-authorized publication of ICML batches B001\u2013B004 (Issue #18). Existing findings retain their scope; publication is not independent scientific confirmation."
  }
}
